{
  "events": [
    {
      "event_id": "governance-universe-approval",
      "event_type": "governance",
      "instrument_ids": [],
      "materiality": "high",
      "priority": 100,
      "published_at": "2026-08-27T12:00:00Z",
      "source_confidence": 100,
      "summary": "目前清單全部為 proposed 且 disabled；不會進入 production signal。",
      "title": "30 個候選標的等待 Owner 核准"
    },
    {
      "event_id": "data-live-adapters-disabled",
      "event_type": "data_quality",
      "instrument_ids": [],
      "materiality": "high",
      "priority": 95,
      "published_at": "2026-08-27T12:00:00Z",
      "source_confidence": 100,
      "summary": "行情、財報、新聞與 ETF 持股皆未抓取；Risk Gate 將所有期間輸出為 NO_SIGNAL。",
      "title": "Live source adapters 尚未啟用"
    }
  ],
  "instruments": [
    {
      "asset_type": "stock",
      "benchmark_id": "TW:BROAD_MARKET",
      "components": {
        "cycle": {
          "confidence": 0,
          "score": null,
          "status": "not_evaluated"
        },
        "events": {
          "confidence": 0,
          "score": null,
          "status": "not_evaluated"
        },
        "fundamental": {
          "confidence": 0,
          "score": null,
          "status": "not_evaluated"
        },
        "macro": {
          "confidence": 0,
          "score": null,
          "status": "not_evaluated"
        },
        "technical": {
          "confidence": 0,
          "score": null,
          "status": "not_evaluated"
        },
        "valuation": {
          "confidence": 0,
          "score": null,
          "status": "not_evaluated"
        }
      },
      "country": "TW",
      "currency": "TWD",
      "data_status": {
        "critical_missing": [
          "live_market_data",
          "point_in_time_fundamentals",
          "approved_universe",
          "calibrated_model"
        ],
        "last_market_session": null,
        "status": "fixture",
        "warnings": [
          "FIXTURE_DATA_ONLY",
          "NOT_PERSONALIZED_INVESTMENT_ADVICE"
        ]
      },
      "enabled": false,
      "horizons": [
        {
          "calibration_status": "not_available",
          "confidence": 0,
          "contrary_evidence": [],
          "horizon": "1W",
          "invalidation_conditions": [
            "Owner approves a versioned universe and model after required validation."
          ],
          "risk_flags": [
            "UNAPPROVED_UNIVERSE",
            "LIVE_DATA_MISSING",
            "MODEL_UNCALIBRATED"
          ],
          "score": null,
          "stance": "NO_SIGNAL",
          "supporting_evidence": []
        },
        {
          "calibration_status": "not_available",
          "confidence": 0,
          "contrary_evidence": [],
          "horizon": "1M",
          "invalidation_conditions": [
            "Owner approves a versioned universe and model after required validation."
          ],
          "risk_flags": [
            "UNAPPROVED_UNIVERSE",
            "LIVE_DATA_MISSING",
            "MODEL_UNCALIBRATED"
          ],
          "score": null,
          "stance": "NO_SIGNAL",
          "supporting_evidence": []
        },
        {
          "calibration_status": "not_available",
          "confidence": 0,
          "contrary_evidence": [],
          "horizon": "3M",
          "invalidation_conditions": [
            "Owner approves a versioned universe and model after required validation."
          ],
          "risk_flags": [
            "UNAPPROVED_UNIVERSE",
            "LIVE_DATA_MISSING",
            "MODEL_UNCALIBRATED"
          ],
          "score": null,
          "stance": "NO_SIGNAL",
          "supporting_evidence": []
        },
        {
          "calibration_status": "not_available",
          "confidence": 0,
          "contrary_evidence": [],
          "horizon": "12M",
          "invalidation_conditions": [
            "Owner approves a versioned universe and model after required validation."
          ],
          "risk_flags": [
            "UNAPPROVED_UNIVERSE",
            "LIVE_DATA_MISSING",
            "MODEL_UNCALIBRATED"
          ],
          "score": null,
          "stance": "NO_SIGNAL",
          "supporting_evidence": []
        }
      ],
      "instrument_id": "TW:STOCK:2330",
      "market": "TWSE",
      "model_applicability": {
        "applicable": false,
        "reason": "Universe 尚未核准，且 live 資料與模型校準尚未完成。"
      },
      "name_en": "Taiwan Semiconductor Manufacturing Company Limited",
      "name_zh": "台積電",
      "provenance": [
        {
          "content_hash": "58520b4462351740202517edd65baf6f75ed2c4df40e7f282378d456481a0f17",
          "fetched_at": "2026-08-27T12:00:00Z",
          "license_class": "project_fixture",
          "market_session_date": null,
          "observed_at": "2026-08-27T12:00:00Z",
          "parser_version": "1.0.0",
          "published_at": null,
          "publisher": "StockmarketAgent test suite",
          "raw_retained": false,
          "source_id": "fixture-tri-market-v1",
          "source_type": "fixture",
          "source_url": "tests/fixtures/research_snapshot.json"
        }
      ],
      "relative_performance": {
        "benchmark_id": "TW:BROAD_MARKET",
        "period": "3M",
        "status": "not_available",
        "value": null
      },
      "selection_rationale": "大型半導體製造候選；需確認資料授權、流動性與主題集中度。",
      "slug": "tsmc",
      "status": "proposed",
      "symbol": "2330",
      "themes": [
        "ai",
        "semiconductor"
      ]
    },
    {
      "asset_type": "stock",
      "benchmark_id": "TW:BROAD_MARKET",
      "components": {
        "cycle": {
          "confidence": 0,
          "score": null,
          "status": "not_evaluated"
        },
        "events": {
          "confidence": 0,
          "score": null,
          "status": "not_evaluated"
        },
        "fundamental": {
          "confidence": 0,
          "score": null,
          "status": "not_evaluated"
        },
        "macro": {
          "confidence": 0,
          "score": null,
          "status": "not_evaluated"
        },
        "technical": {
          "confidence": 0,
          "score": null,
          "status": "not_evaluated"
        },
        "valuation": {
          "confidence": 0,
          "score": null,
          "status": "not_evaluated"
        }
      },
      "country": "TW",
      "currency": "TWD",
      "data_status": {
        "critical_missing": [
          "live_market_data",
          "point_in_time_fundamentals",
          "approved_universe",
          "calibrated_model"
        ],
        "last_market_session": null,
        "status": "fixture",
        "warnings": [
          "FIXTURE_DATA_ONLY",
          "NOT_PERSONALIZED_INVESTMENT_ADVICE"
        ]
      },
      "enabled": false,
      "horizons": [
        {
          "calibration_status": "not_available",
          "confidence": 0,
          "contrary_evidence": [],
          "horizon": "1W",
          "invalidation_conditions": [
            "Owner approves a versioned universe and model after required validation."
          ],
          "risk_flags": [
            "UNAPPROVED_UNIVERSE",
            "LIVE_DATA_MISSING",
            "MODEL_UNCALIBRATED"
          ],
          "score": null,
          "stance": "NO_SIGNAL",
          "supporting_evidence": []
        },
        {
          "calibration_status": "not_available",
          "confidence": 0,
          "contrary_evidence": [],
          "horizon": "1M",
          "invalidation_conditions": [
            "Owner approves a versioned universe and model after required validation."
          ],
          "risk_flags": [
            "UNAPPROVED_UNIVERSE",
            "LIVE_DATA_MISSING",
            "MODEL_UNCALIBRATED"
          ],
          "score": null,
          "stance": "NO_SIGNAL",
          "supporting_evidence": []
        },
        {
          "calibration_status": "not_available",
          "confidence": 0,
          "contrary_evidence": [],
          "horizon": "3M",
          "invalidation_conditions": [
            "Owner approves a versioned universe and model after required validation."
          ],
          "risk_flags": [
            "UNAPPROVED_UNIVERSE",
            "LIVE_DATA_MISSING",
            "MODEL_UNCALIBRATED"
          ],
          "score": null,
          "stance": "NO_SIGNAL",
          "supporting_evidence": []
        },
        {
          "calibration_status": "not_available",
          "confidence": 0,
          "contrary_evidence": [],
          "horizon": "12M",
          "invalidation_conditions": [
            "Owner approves a versioned universe and model after required validation."
          ],
          "risk_flags": [
            "UNAPPROVED_UNIVERSE",
            "LIVE_DATA_MISSING",
            "MODEL_UNCALIBRATED"
          ],
          "score": null,
          "stance": "NO_SIGNAL",
          "supporting_evidence": []
        }
      ],
      "instrument_id": "TW:STOCK:2454",
      "market": "TWSE",
      "model_applicability": {
        "applicable": false,
        "reason": "Universe 尚未核准，且 live 資料與模型校準尚未完成。"
      },
      "name_en": "MediaTek Inc.",
      "name_zh": "聯發科",
      "provenance": [
        {
          "content_hash": "58520b4462351740202517edd65baf6f75ed2c4df40e7f282378d456481a0f17",
          "fetched_at": "2026-08-27T12:00:00Z",
          "license_class": "project_fixture",
          "market_session_date": null,
          "observed_at": "2026-08-27T12:00:00Z",
          "parser_version": "1.0.0",
          "published_at": null,
          "publisher": "StockmarketAgent test suite",
          "raw_retained": false,
          "source_id": "fixture-tri-market-v1",
          "source_type": "fixture",
          "source_url": "tests/fixtures/research_snapshot.json"
        }
      ],
      "relative_performance": {
        "benchmark_id": "TW:BROAD_MARKET",
        "period": "3M",
        "status": "not_available",
        "value": null
      },